{
  "meta": {
    "id": "sprint-planning",
    "title": "Sprint Planning",
    "title_vi": "Họp lập kế hoạch sprint",
    "description": "Plan the upcoming sprint: review backlog items, estimate effort, discuss capacity, and commit to deliverables.",
    "difficulty": "intermediate",
    "duration_minutes": 15,
    "category": "team-communication",
    "tags": ["sprint", "agile", "planning", "estimation"]
  },
  "nodes": [
    {
      "id": "opening",
      "label": "Opening",
      "label_vi": "Mở đầu"
    },
    {
      "id": "backlog-review",
      "label": "Backlog Review",
      "label_vi": "Xem lại backlog"
    },
    {
      "id": "estimation",
      "label": "Estimation",
      "label_vi": "Ước lượng"
    },
    {
      "id": "capacity",
      "label": "Capacity Check",
      "label_vi": "Kiểm tra năng lực"
    },
    {
      "id": "commitment",
      "label": "Commitment",
      "label_vi": "Cam kết"
    },
    {
      "id": "closing",
      "label": "Closing",
      "label_vi": "Kết thúc"
    }
  ],
  "chunks": [
    {
      "id": "opening-01",
      "node_id": "opening",
      "text": "Let's start the sprint planning.",
      "example": "Let's start the sprint planning for this iteration.",
      "translation_vi": "Bắt đầu họp lập kế hoạch sprint cho đợt này.",
      "audio": "",
      "audio_slow": "",
      "phrases": [
        {"text": "Let's start", "audio": "", "audio_slow": ""},
        {"text": "the sprint planning", "audio": "", "audio_slow": ""},
        {"text": "for this iteration.", "audio": "", "audio_slow": ""}
      ]
    },
    {
      "id": "opening-02",
      "node_id": "opening",
      "text": "We have a lot to cover today.",
      "example": "We have a lot to cover today, so let's stay focused.",
      "translation_vi": "Hôm nay có nhiều việc cần bàn, nên hãy tập trung nhé.",
      "audio": "",
      "audio_slow": "",
      "phrases": [
        {"text": "We have a lot to cover today,", "audio": "", "audio_slow": ""},
        {"text": "so let's stay focused.", "audio": "", "audio_slow": ""}
      ]
    },
    {
      "id": "opening-03",
      "node_id": "opening",
      "text": "First, let's review the backlog.",
      "example": "First, let's review the top priority items.",
      "translation_vi": "Đầu tiên, hãy xem xét các mục ưu tiên cao nhất.",
      "audio": "",
      "audio_slow": "",
      "phrases": [
        {"text": "First, let's review", "audio": "", "audio_slow": ""},
        {"text": "the top priority items.", "audio": "", "audio_slow": ""}
      ]
    },
    {
      "id": "opening-04",
      "node_id": "opening",
      "text": "Who is the product owner today?",
      "example": "Who is the product owner presenting today?",
      "translation_vi": "Hôm nay ai là product owner trình bày?",
      "audio": "",
      "audio_slow": "",
      "phrases": [
        {"text": "Who is the product owner", "audio": "", "audio_slow": ""},
        {"text": "presenting today?", "audio": "", "audio_slow": ""}
      ]
    },
    {
      "id": "opening-05",
      "node_id": "opening",
      "text": "I'll facilitate the session.",
      "example": "I'll facilitate the session. Let's go around the room.",
      "translation_vi": "Tôi sẽ điều phối buổi họp. Mọi người lần lượt phát biểu nhé.",
      "audio": "",
      "audio_slow": "",
      "phrases": [
        {"text": "I'll facilitate the session.", "audio": "", "audio_slow": ""},
        {"text": "Let's go around the room.", "audio": "", "audio_slow": ""}
      ]
    },
    {
      "id": "backlog-review-01",
      "node_id": "backlog-review",
      "text": "This is the top priority story.",
      "example": "This is the top priority story for the customer.",
      "translation_vi": "Đây là story ưu tiên cao nhất cho khách hàng.",
      "audio": "",
      "audio_slow": "",
      "phrases": [
        {"text": "This is the top priority story", "audio": "", "audio_slow": ""},
        {"text": "for the customer.", "audio": "", "audio_slow": ""}
      ]
    },
    {
      "id": "backlog-review-02",
      "node_id": "backlog-review",
      "text": "Can you explain the requirements?",
      "example": "Can you explain the requirements for this feature?",
      "translation_vi": "Bạn giải thích yêu cầu cho tính năng này được không?",
      "audio": "",
      "audio_slow": "",
      "phrases": [
        {"text": "Can you explain", "audio": "", "audio_slow": ""},
        {"text": "the requirements", "audio": "", "audio_slow": ""},
        {"text": "for this feature?", "audio": "", "audio_slow": ""}
      ]
    },
    {
      "id": "backlog-review-03",
      "node_id": "backlog-review",
      "text": "What is the acceptance criteria?",
      "example": "What is the acceptance criteria for the RAG pipeline?",
      "translation_vi": "Tiêu chí chấp nhận cho RAG pipeline là gì?",
      "audio": "",
      "audio_slow": "",
      "phrases": [
        {"text": "What is the acceptance criteria", "audio": "", "audio_slow": ""},
        {"text": "for the RAG pipeline?", "audio": "", "audio_slow": ""}
      ]
    },
    {
      "id": "backlog-review-04",
      "node_id": "backlog-review",
      "text": "Let's break this down into tasks.",
      "example": "Let's break this story down into smaller tasks.",
      "translation_vi": "Hãy chia nhỏ story này thành các task nhỏ hơn.",
      "audio": "",
      "audio_slow": "",
      "phrases": [
        {"text": "Let's break this story down", "audio": "", "audio_slow": ""},
        {"text": "into smaller tasks.", "audio": "", "audio_slow": ""}
      ]
    },
    {
      "id": "backlog-review-05",
      "node_id": "backlog-review",
      "text": "Are there any dependencies?",
      "example": "Are there any dependencies on the embedding service?",
      "translation_vi": "Có phụ thuộc nào vào embedding service không?",
      "audio": "",
      "audio_slow": "",
      "phrases": [
        {"text": "Are there any dependencies", "audio": "", "audio_slow": ""},
        {"text": "on the embedding service?", "audio": "", "audio_slow": ""}
      ]
    },
    {
      "id": "estimation-01",
      "node_id": "estimation",
      "text": "How many story points is this?",
      "example": "How many story points is this feature?",
      "translation_vi": "Tính năng này bao nhiêu story points?",
      "audio": "",
      "audio_slow": "",
      "phrases": [
        {"text": "How many story points", "audio": "", "audio_slow": ""},
        {"text": "is this feature?", "audio": "", "audio_slow": ""}
      ]
    },
    {
      "id": "estimation-02",
      "node_id": "estimation",
      "text": "I'd estimate it at...",
      "example": "I'd estimate it at five story points.",
      "translation_vi": "Tôi ước lượng khoảng 5 story points.",
      "audio": "",
      "audio_slow": "",
      "phrases": [
        {"text": "I'd estimate it at", "audio": "", "audio_slow": ""},
        {"text": "five story points.", "audio": "", "audio_slow": ""}
      ]
    },
    {
      "id": "estimation-03",
      "node_id": "estimation",
      "text": "I think it's more complex.",
      "example": "I think it's more complex than that. Maybe eight points.",
      "translation_vi": "Tôi nghĩ nó phức tạp hơn thế. Có thể 8 points.",
      "audio": "",
      "audio_slow": "",
      "phrases": [
        {"text": "I think it's more complex than that.", "audio": "", "audio_slow": ""},
        {"text": "Maybe eight points.", "audio": "", "audio_slow": ""}
      ]
    },
    {
      "id": "estimation-04",
      "node_id": "estimation",
      "text": "Let's take the average.",
      "example": "Let's take the average of all estimates.",
      "translation_vi": "Hãy lấy trung bình các ước lượng.",
      "audio": "",
      "audio_slow": "",
      "phrases": [
        {"text": "Let's take the average", "audio": "", "audio_slow": ""},
        {"text": "of all estimates.", "audio": "", "audio_slow": ""}
      ]
    },
    {
      "id": "estimation-05",
      "node_id": "estimation",
      "text": "I'm not sure about this one.",
      "example": "I'm not sure about this one. Can we discuss it more?",
      "translation_vi": "Tôi không chắc về cái này. Chúng ta bàn thêm được không?",
      "audio": "",
      "audio_slow": "",
      "phrases": [
        {"text": "I'm not sure about this one.", "audio": "", "audio_slow": ""},
        {"text": "Can we discuss it more?", "audio": "", "audio_slow": ""}
      ]
    },
    {
      "id": "capacity-01",
      "node_id": "capacity",
      "text": "What is our team's velocity?",
      "example": "What is our team's velocity this sprint?",
      "translation_vi": "Vận tốc của team sprint này là bao nhiêu?",
      "audio": "",
      "audio_slow": "",
      "phrases": [
        {"text": "What is our team's velocity", "audio": "", "audio_slow": ""},
        {"text": "this sprint?", "audio": "", "audio_slow": ""}
      ]
    },
    {
      "id": "capacity-02",
      "node_id": "capacity",
      "text": "We have enough capacity for...",
      "example": "We have enough capacity for about thirty points.",
      "translation_vi": "Chúng ta có đủ năng lực cho khoảng 30 points.",
      "audio": "",
      "audio_slow": "",
      "phrases": [
        {"text": "We have enough capacity", "audio": "", "audio_slow": ""},
        {"text": "for about thirty points.", "audio": "", "audio_slow": ""}
      ]
    },
    {
      "id": "capacity-03",
      "node_id": "capacity",
      "text": "Some of us are on leave.",
      "example": "Some of us are on leave next week, so capacity is lower.",
      "translation_vi": "Một số người nghỉ phép tuần sau, nên năng lực thấp hơn.",
      "audio": "",
      "audio_slow": "",
      "phrases": [
        {"text": "Some of us are on leave next week,", "audio": "", "audio_slow": ""},
        {"text": "so capacity is lower.", "audio": "", "audio_slow": ""}
      ]
    },
    {
      "id": "capacity-04",
      "node_id": "capacity",
      "text": "We need to budget for tech debt.",